#,"Total Backlinks","Domain Rating","URL Rating (desc)","Referring Domains","Referring Page URL","Referring Page Title","Internal Links Count","External Links Count","Link URL",TextPre,"Link Anchor",TextPost,Type,"Backlink Status","First Seen","Last Check","Day Lost",Language,Traffic,Keywords,"Js rendered","Linked Domains"
58,1,43,9,0,http://forums.ulyanovskcity.ru/index.php?/topic/17823-пластический-хирург/,"Пластический хирург - Здоровье - Ульяновск - территория свободного общения",73,105,https://blokhin.ru/,"в России. Поэтому я бы посоветовал обратиться именно к нему",https://blokhin.ru/,.,Nofollow,,"2019-11-11 04:11:47","2020-04-14 18:26:01",,ru,0,0,,17
59,16,11,9,0,https://mail.plasty-top.ru/rating/?CENA=103,"Центр пластики.",275,33,http://www.blokhin.ru/,"Адрес сайта клиники:",www.blokhin.ru,,Dofollow,,"2019-05-09 15:03:09","2020-03-29 11:25:14",,ru,0,0,,20
60,12,38,9,0,http://www.aspirantura.spb.ru/forum/printthread.php?t=6142&pp=15&page=178,"Портал аспирантов - Физкультура и спорт в жизни учёных и аспирантов",14,12,http://www.blokhin.ru/upload/img/gluteo/1248957590_b.jpg,,http://www.blokhin.ru/upload/img/glu...48957590_b.jpg,,Dofollow,,"2017-04-09 15:22:59","2020-04-13 14:05:01",,ru,0,0,,5
61,2,46,9,0,https://forum.study.ru/index.php?topic=53550.msg210354;topicseen,"Пластический хирург",65,49,https://blokhin.ru/,"меня такими данными. Чтобы была красивая грудь мне понадобилось вмешательство","лучшего пластического хирурга",". Только это специалист смог воплотить мою мечту детства в",Dofollow,,"2019-07-12 10:26:53","2020-05-04 04:11:52",,ru,0,0,,18
62,5,32,9,0,http://www.kosmetichka.ru/pub_4400/,"Пластические операции на лице",50,7,http://www.blokhin.ru/podtazhka-lba.php,"и складки, с помощью неё может быть без труда выполнена","подтяжка лба","или щек.","Dofollow, Content",,"2014-04-06 04:26:01","2020-04-09 23:44:06",,ru,0,0,,1
63,2,32,9,0,http://www.kosmetichka.ru/pub_4400/,"Пластические операции на лице",50,7,http://www.blokhin.ru/,"доверить изменение своей внешности, не стоит спешить. Это должен быть","один из лучших пластических хирургов",", который действительно знает свое дело и сделал множество пластических","Dofollow, Content",,"2014-04-06 04:26:01","2020-04-09 23:44:06",,ru,0,0,,1
64,4,44,9,0,http://cosmetology-info.ru/surgeons/ru/msk/Blokhin-Sergey-Nikolaevich/,"Пластический хирург Блохин Сергей Николаевич, Москва",181,9,http://www.blokhin.ru/,"Сайт хирурга:",http://www.blokhin.ru/,,"Nofollow, Content",,"2020-03-26 21:33:47","2020-05-31 06:04:58",,ru,0,0,,7
65,5,29,9,1,http://www.chirkofff.com/zdorove-i-krasota-2/kak-provoditsya-uvelichenie-grudi.html,"Как проводится увеличение груди? | Трезвость и Здоровье",41,18,http://www.blokhin.ru/,"Периареолярный надрез проводится вокруг ареолы соска - это требует размещать","грудные импланты","через небольшие отверстия. Такие операции являются сложными из-за степени риска:","Dofollow, Content",,"2020-03-22 18:07:51","2020-06-11 12:55:29",,ru,,,,6
66,5,29,9,1,http://www.chirkofff.com/zdorove-i-krasota-2/kak-provoditsya-uvelichenie-grudi.html,"Как проводится увеличение груди? | Трезвость и Здоровье",41,18,http://www.blokhin.ru/mammoplastica.php,"Липофилинг – наиболее безопасная и современная","операция по пластике груди",". Она появилась недавно, в результате исследований в институте трансплантологии.","Dofollow, Content",,"2020-01-14 07:59:47","2020-06-11 12:55:29",,ru,,,,6
67,36,46,9,0,http://www.internetkniga.ru/catalog/595/1/2_21.html,"Адресная книга Интернет. Желтые страницы - БОЛЬНИЦЫ, КЛИНИКИ, МЕДИЦИНСКИЕ ЦЕНТРЫ / МЕДИЦИНА / МЕДИЦИНА, КРАСОТА И ЗДОРОВЬЕ /",132,58,http://www.blokhin.ru/,,"клиника пластической хирургии",,Dofollow,,"2020-06-15 04:14:00","2020-06-15 04:14:00",,ru,0,0,,39
68,1,33,9,0,https://podium.life/advert-april-2014/Vidi-plastiki-grudi,"Виды пластики груди - Podium.Life",41,5,http://www.blokhin.ru/,Тематический,"сайт пластического хирурга Блохина","иллюстрирует посетителям все возможности современной медицины. В первую очередь, представлены","Dofollow, Content",,"2018-09-07 12:40:49","2018-09-07 12:40:49",,ru,0,0,,4
69,1,33,9,0,https://podium.life/advert-april-2014/Vidi-plastiki-grudi,"Виды пластики груди - Podium.Life",41,5,http://www.blokhin.ru/mammoplastica.php,"Мастопексия. Данная","пластика груди","позволяет подтянуть обвисшие участки, которые образовываются по различным причинам:","Dofollow, Content",,"2018-09-07 12:40:49","2018-09-07 12:40:49",,ru,0,0,,4
70,2,44,9,0,http://www.searchtoday.ru/add-articles/article-47364.html,"SEARCHTODAY.RU - увеличение груди, абдоминопластика | Медицина и здоровье | http://www.blokhin.ru/",15,8,http://www.blokhin.ru/,"Название ссылки:","увеличение груди, абдоминопластика",,Nofollow,,"2015-10-31 01:12:19","2020-05-29 04:02:35",,,0,0,,6
71,1,38,9,0,http://offtop.ru/procomp/view.php?part=1&t=1792847&only=,помогите,15,2,https://blokhin.ru/,"каждого кому-то нравится силиконовая грудь кому-то нет. Ей главное выбрать","лучшего пластического хирурга",", который сможет сделать идеальную грудь.","Dofollow, Content",,"2019-07-04 16:06:25","2019-08-24 16:42:12",,ru,0,0,,2
72,5,41,9,0,https://melochi-jizni.ru/publ/84-1-0-2000,"Подтяжка груди как метод решения проблемы обвисшей груди",42,11,http://www.blokhin.ru/services/podtjazhka-grudi,"В медицинской области","подтяжка груди","имеет вполне конкретное название – мастопексия. Проводится такая операция под","Dofollow, Content",,"2020-04-25 07:30:58","2020-06-13 14:56:58",,ru,,,,3
73,4,41,9,0,https://melochi-jizni.ru/publ/84-1-0-2000,"Подтяжка груди как метод решения проблемы обвисшей груди",42,11,http://www.blokhin.ru/services/,"чувство уверенности в себе и качество жизни значительно повысится. Ваша","обвисшая грудь","приобретет природную форму и прошедшую молодость.","Dofollow, Content",,"2020-04-25 07:30:58","2020-06-13 14:56:58",,ru,,,,3
74,5,40,8,0,http://perevodika.ru/interesnoe/m10/esli-zhivot-vasha-problemnaya-zona.php,"Переводика - Если живот ваша проблемная зона....",67,13,http://www.blokhin.ru/abdomin.php,"вы сможете, набрав на любом поисковом сайте в Интернете фразу:","абдоминопластика цены",.,"Dofollow, Content",,"2018-11-02 16:35:58","2020-06-15 02:18:26",,ru,0,0,,4
75,3,40,8,0,http://perevodika.ru/interesnoe/m10/esli-zhivot-vasha-problemnaya-zona.php,"Переводика - Если живот ваша проблемная зона....",67,13,http://www.blokhin.ru/,"операциям, следует тщательно исследовать этот вопрос, набрав в поисковой системе:","пластический хирург москва",.,"Dofollow, Content",,"2018-11-02 16:35:58","2020-06-15 02:18:26",,ru,0,0,,4
76,10,40,8,0,http://www.besttoday.ru/texts/926.html,"BesTToday. Подтяжка лица: обратная сторона",83,58,http://www.blokhin.ru/facelifting.php,"В крайне редких случаях",фейслифтинг,"осложняется занесением инфекции, деформациями ушных раковин, повреждениями околоушных желез. Чтобы","Dofollow, Content",,"2018-04-13 08:48:05","2020-04-22 19:11:36",,ru,0,0,,12
77,10,40,8,0,http://www.besttoday.ru/texts/926.html,"BesTToday. Подтяжка лица: обратная сторона",83,58,http://www.blokhin.ru/podtazhka-lba.php,"в возрасте от 40 до 50 лет. Параллельно могут производиться","подтяжка лба",", блефаропластика, подтяжка шеи.","Dofollow, Content",,"2018-04-13 08:48:05","2020-04-22 19:11:36",,ru,0,0,,12
78,2,38,8,0,http://www.ktoprodvinul.ru/?company_id=9&date=2011-11-12&page=2,"Кто продвинул.ру - Оптимизм.ру ® клиенты, список проектов Оптимизм.ру ®",21,250,http://www.blokhin.ru/,,blokhin.ru,6,Dofollow,,"2019-07-11 19:03:28","2020-05-14 12:04:54",,ru,0,0,,108
79,6,38,8,0,http://www.ktoprodvinul.ru/?company_id=9&date=2014-02-13&page=4,"Кто продвинул.ру - Оптимизм.ру ® клиенты, список проектов Оптимизм.ру ®",19,266,http://www.blokhin.ru/,,blokhin.ru,,Dofollow,,"2019-07-10 05:15:35","2020-05-12 04:52:20",,ru,0,0,,110
80,4,36,8,0,https://all4wedding.com/article/30814_1_Kak-sdelat-grud-svoey-mechty,"Как сделать грудь своей мечты?",109,12,http://blokhin.ru/endoprotezirovanie-grudi.php,"которой устанавливаются показания и выявляются противопоказания к пластике. Таким образом,","эндопротезирование груди","может быть по эстетическим (когда пациентка хочет увеличить грудь, исходя",Dofollow,,"2019-12-13 12:39:29","2019-12-13 12:39:29",,ru,0,0,,8
81,4,37,8,0,http://inwind.ru/dir/item28130.html,"Изменение формы голени / Каталог прямых ссылок InWind.ru",9,4,http://www.blokhin.ru/,,"Изменение формы голени",,"Dofollow, Content",,"2020-03-25 05:53:04","2020-03-25 05:53:04",,ru,0,0,,3
82,1,33,8,0,http://guide.phonezone.ru/out.php?url=http://www.blokhin.ru,,0,1,http://www.blokhin.ru/,,,,"Dofollow, Redirect",,"2020-05-06 18:25:27","2020-05-06 18:25:27",,,0,0,,1
83,10,20,8,1,https://www.3vozrast.ru/article/beauty/u_zerkala/7491/,"Ровные и красивые ноги: как добиться мечты?",93,26,http://www.blokhin.ru/ispravlenie_krivykh_nog.php,"после проведения процедуры потребуется остаться в стационаре клиники, где проводилось","исправление кривых ног",", примерно на неделю или около 10 дней. Ходить вначале","Dofollow, Content",,"2019-01-23 00:03:22","2020-04-11 09:00:05",,ru,0,0,,12
84,10,20,8,1,https://www.3vozrast.ru/article/beauty/u_zerkala/7491/,"Ровные и красивые ноги: как добиться мечты?",93,26,http://www.blokhin.ru/kruroplastika.php,"им современная пластическая хирургия. Операция по исправлению кривизны ног называется",круропластика,". Она заключается в установке специально подобранного импланта, при необходимости","Dofollow, Content",,"2019-01-23 00:03:22","2020-04-11 09:00:05",,ru,0,0,,12
85,5,36,8,0,https://www.vitaminov.net/rus-prochee-0-0-23200.html,"Пластика висков: голливудская операция вернет молодость - Прочее - Vitaminov.net",60,12,http://www.blokhin.ru/cheek-lifting.php,"швами. Процедуру можно совместить с другими методиками, например, очень популярен",чек-лифтинг,"– подтяжка средней трети лица.","Dofollow, Content",,"2020-06-03 10:14:25","2020-06-03 10:14:25",,ru,0,0,,3
86,5,36,8,0,https://www.vitaminov.net/rus-prochee-0-0-23200.html,"Пластика висков: голливудская операция вернет молодость - Прочее - Vitaminov.net",60,12,http://www.blokhin.ru/plastika-skul.php,"Благодаря современной хирургии возможно проведение таких операций, как поднятие бровей,","пластика скул",", век, взгляд становится более открытым, выразительным и кокетливым. Окружающие","Dofollow, Content",,"2020-06-03 10:14:25","2020-06-03 10:14:25",,ru,0,0,,3
87,1,37,8,0,http://medprom.ru/medprom/2862568,"липофилинг груди: доктор блохин гарантирует отличный результат",37,9,https://blokhin.ru/services/lipofiling-grudi/,,"Липофилинг груди","— не самая сложная пластическая операция. Однако такая коррекция требует","Dofollow, Content",,"2020-05-31 06:42:56","2020-05-31 06:42:56",,ru,0,0,,7
88,5,34,8,0,https://womansy.com/bodycare/kombinirovannye-operacii/,"Комбинированные операции",37,8,http://www.blokhin.ru/services/podtjazhka-i-uvelichenie-grudi/,"На данный момент","увеличение и подтяжка груди","одновременно вполне возможны. По сути, это ряд операций, которые не","Dofollow, Content",,"2020-02-23 08:25:18","2020-06-09 02:57:26",,ru,0,0,,2
89,2,34,8,0,https://womansy.com/bodycare/kombinirovannye-operacii/,"Комбинированные операции",37,8,http://www.blokhin.ru/,"у самого специалиста, он в идеале знает, что собой представляет","пластика груди. Москва","имеет своих выдающихся профессионалов пластической хирургии, о них вы можете","Dofollow, Content",,"2018-07-08 19:22:41","2020-06-09 02:57:26",,ru,0,0,,2
90,10,9,8,1,http://plastic-review.com/column/date/2015-09-23,"Пластический хирург Мария Егорова",64,20,http://www.blokhin.ru/kolporafiya.php,"В некоторых случаях, передняя и задняя",кольпорафия,"проводятся в ходе одной операции, если деформация стенок влагалища сильно","Dofollow, Content",,"2016-02-17 17:27:24","2020-06-12 01:25:07",,ru,0,0,,9
91,6,9,8,1,http://plastic-review.com/column/date/2013-12-13,"Пластический хирург Сергей Блохин",68,11,http://blokhin.ru/,"тенденций, которые лежат на поверхности и представляют большой интерес. Профессор","Сергей Николаевич Блохин",", основатель клиники пластической хирургии FrauKlinik, рассказал об особенностях современной","Dofollow, Content",,"2016-02-28 02:40:10","2020-06-11 17:38:04",,ru,,,,7
92,5,34,8,0,https://nn-terra.ru/sovremennye-metodiki-esteticheskoy-i-rekonstruktivnoy-hirurgii-0,"Современные методики эстетической и реконструктивной хирургии — Терра Инкогнита",59,7,http://www.blokhin.ru/,"Оперирующий хирург - Сергей Николаевич Блохин (г. Москва)(",www.blokhin.ru,") – профессор, доктор медицинских наук, пластический хирург с 30-летним",Dofollow,,"2019-06-02 12:53:43","2020-06-15 14:31:02",,ru,,,,5
93,5,34,8,0,https://nn-terra.ru/sovremennye-metodiki-esteticheskoy-i-rekonstruktivnoy-hirurgii-mammoplastika-glyuteoplastika,"«Современные методики эстетической и реконструктивной хирургии» Маммопластика, глютеопластика, круропластика — Терра Инкогнита",11,7,http://www.blokhin.ru/,"Оперирующий хирург – Сергей Николаевич Блохин(",www.blokhin.ru,") – профессор, доктор медицинских наук, пластический хирург с 30-летним","Dofollow, Content",,"2019-06-09 11:15:18","2020-06-16 06:57:07",,ru,0,1,,5
94,2,35,8,0,https://www.moi-goda.ru/novosti-zdravoochraneniya/rekonstruktsiya-grudi-po-metodu-blochina-preimuschestva-pered-drugimi-operatsiyami,"Реконструкция груди по методу Блохина: преимущества перед другими операциями",519,12,https://blokhin.ru/services/rekonstrukcija-grudi/,"Учитывая индивидуальные особенности, профессор Блохин выбирает наиболее эффективный способ","реконструкции груди",:,"Dofollow, Content",,"2020-05-22 12:17:26","2020-06-12 23:32:26",,ru,0,0,,8
95,115,8,8,0,http://www.rosmedic.ru/eto-polezno-znat/kak-mozhno-izmenit-litso-pri-pomoschi-hirurgii.html,"Медицинская информация. Скачать книги по медицине. - Как можно изменить лицо при помощи хирургии?",127,12,http://www.blokhin.ru/plastika-brovej.php,"контролировать весь процесс вмешательства и определять ход микроманипуляций. Так проводится","пластика бровей",", подтяжка кожи верхних век. Результат такой процедуры потрясающий: швы","Dofollow, Content",,"2018-06-07 08:20:26","2020-04-27 04:30:27",,ru,0,0,,3
96,115,8,8,0,http://www.rosmedic.ru/eto-polezno-znat/kak-mozhno-izmenit-litso-pri-pomoschi-hirurgii.html,"Медицинская информация. Скачать книги по медицине. - Как можно изменить лицо при помощи хирургии?",127,12,http://www.blokhin.ru/services/plastika-verhnih-vek/,"типов, в зависимости от того, в какой части лица проводится:","верхняя блефаропластика",", средняя и нижняя подтяжка. За счет техники СМАС операция","Dofollow, Content",,"2020-03-23 02:42:15","2020-04-27 04:30:27",,ru,0,0,,3
97,4,31,8,0,http://vseoplastike.ru/novosti/detail/344078,"Frau Klinik теперь в «Перезагрузке» на ТНТ!",130,33,http://www.blokhin.ru/,"Уже несколько лет подряд ведущий хирург страны","профессор Блохин","кардинально меняет женщин в программе Первого канала «На 10 лет моложе».","Dofollow, Content",,"2017-05-19 08:26:43","2020-03-21 18:05:16",,ru,0,0,,27
98,2,33,8,0,http://forum.butovo.com/viewthread.php?action=printable&fid=16&tid=80468,"Butovo.com Forum - Блефаропластика - Powered by XMB",6,5,https://blokhin.ru/,"блефаропластику сделать, и не раз слышала, что именно он -","лучший пластический хирург",". Многие знаменитости лежали у него на операционном столе. А",Dofollow,,"2019-06-19 23:14:31","2020-06-04 14:39:43",,ru,0,0,,5
99,4,31,8,0,http://vseoplastike.ru/articles/detail/356991,"Как выглядят жены пластических хирургов? Топ-5 пар мира",131,34,http://blokhin.ru/,"Оба поступили в Первый медицинский институт в Москве, затем поженились. За годы работы","Сергей Блохин","прооперировал более 30 000 пациентов, в начале своей карьеры работал в онкологическом центре, где","Dofollow, Content",,"2017-10-08 19:13:00","2020-03-28 06:35:13",,ru,0,0,,28
100,10,15,8,1,http://zhivem-zdorovo.com/medicina/grud-raznogo-razmera/,"Грудь разного размера | Живем здорово 2.0",31,17,http://www.blokhin.ru/services/,"данного косметического дефекта врачи рекомендуют маммопластику, которая может включать как","удаление грудных имплантатов","так и полную подтяжку органа. В каждом индивидуальном случае врач","Dofollow, Content",,"2020-03-28 02:19:28","2020-06-07 14:50:07",,ru,0,0,,8
101,4,15,8,1,http://zhivem-zdorovo.com/medicina/grud-raznogo-razmera/,"Грудь разного размера | Живем здорово 2.0",31,17,http://www.blokhin.ru/grud_raznogo_razmera.php,"Как свидетельствует статистика,","грудь разного размера","имеют более 2/3 всех женщин. Асимметрия может быть выражена в","Dofollow, Content",,"2018-04-23 21:31:15","2020-06-07 14:50:07",,ru,0,0,,8
102,4,31,8,0,http://www.betops.info/detail.php?lid=28941,"абдоминопластика, пластическая хирургия",29,10,http://www.blokhin.ru/,,http://www.blokhin.ru/,,Dofollow,,"2019-02-10 05:03:35","2020-04-18 23:29:21",,ru,0,0,,6
103,3,27,8,0,https://bgforum.ru/flame/938/,"Пластические операции...",52,10,http://www.blokhin.ru/experience.asp,,"Клиника пластической хирургии",,Nofollow,,"2016-04-19 13:17:35","2020-05-14 00:48:12",,ru,0,0,,4
104,2,28,8,0,https://osk-market.ru/ru/user/id45383,"Алена Соковецкая | GetRejoin - Есть Ответ!",36,14,https://blokhin.ru/services/podtjazhka-grudi/,"даже больше косметический вопрос) нужно относиться с полной ответственностью. Я","подтяжку груди","делала у Блохина С.Н. во ФрауКлиник. Операция длилась около трёх",Dofollow,,"2020-04-04 09:12:49","2020-04-26 14:24:51",,ru,0,0,,11
105,13,4,8,2,http://vseokosmetike.ru/forum/posts/detail/1459/1891/all/20,"Форум / Пластическая хирургия / Общие вопросы пластической хирургии / Пугающие сайты пластических хирургов.",75,52,http://www.blokhin.ru/,-,www.blokhin.ru,,"Dofollow, Content",,"2019-02-07 08:03:22","2020-05-21 07:07:52",,ru,0,0,,7
106,2,31,8,0,http://vseoplastike.ru/kolonka/detail/87807,"Главные тенденции в пластике",153,33,http://blokhin.ru/,"несколько тенденций, которые лежат на поверхности и представляют большой интерес. Профессор","Сергей Николаевич Блохин",", основатель клиники пластической хирургии FrauKlinik, рассказал об особенностях современной «хирургии","Dofollow, Content",,"2019-01-07 16:04:28","2020-03-26 05:17:39",,ru,0,0,,27
107,5,31,8,0,http://vseoplastike.ru/articles/detail/87256,"Три самые популярные пластические операции после родов",135,41,http://www.blokhin.ru/abdomin.php,,"пластика живота",,Dofollow,,"2016-03-01 09:38:49","2020-05-27 16:00:33",,ru,0,0,,27
108,5,31,8,0,http://vseoplastike.ru/articles/detail/87256,"Три самые популярные пластические операции после родов",135,41,http://www.blokhin.ru/mammoplastica.php,,"подтяжка и/или увеличение молочных желез",,"Dofollow, Content",,"2016-03-01 09:38:49","2020-05-27 16:00:33",,ru,0,0,,27
109,6,31,8,0,https://www.chudopredki.ru/6645-rastyazhki-na-grudi-posle-kormleniya.html,"Растяжки на груди после кормления » Chudopredki.ru - Ребенок и дети, беременность, роды, родители",175,9,http://www.blokhin.ru/podtyazhka-grudi.php,"специалист после обследования. При ярко выраженном птозе может выполняться операционная","подтяжка груди",", суть которой состоит в перемещении сосково-ареолярного комплекса в более","Dofollow, Content",,"2018-04-20 14:02:13","2020-06-10 01:34:17",,ru,0,0,,1
