#,"Total Backlinks","Domain Rating","URL Rating (desc)","Referring Domains","Referring Page URL","Referring Page Title","Internal Links Count","External Links Count","Link URL",TextPre,"Link Anchor",TextPost,Type,"Backlink Status","First Seen","Last Check","Day Lost",Language,Traffic,Keywords,"Js rendered","Linked Domains"
110,3,31,8,0,https://www.chudopredki.ru/6645-rastyazhki-na-grudi-posle-kormleniya.html,"Растяжки на груди после кормления » Chudopredki.ru - Ребенок и дети, беременность, роды, родители",175,9,http://www.blokhin.ru/,"Пока молодая мама кормит грудью, ни один косметолог или","пластический хирург","не может помочь в устранении косметического дефекта. В лактационный период","Dofollow, Content",,"2018-04-20 14:02:13","2020-06-10 01:34:17",,ru,0,0,,1
111,5,34,8,0,http://psystatus.ru/partner_article.php?id=601,"Деформация сосков и их коррекция",455,9,http://www.blokhin.ru/services/plastika-areoly-i-soskov/,"комплекс неполноценности из-за неэстетичности груди. Поэтому зачастую женщина решается на","уменьшение ареол",", нередко в качестве дополнительной манипуляции в рамках маммопластики.","Dofollow, Content",,"2020-06-07 05:15:20","2020-06-07 05:15:20",,ru,0,0,,3
112,2,34,8,0,http://psystatus.ru/partner_article.php?id=601,"Деформация сосков и их коррекция",455,9,http://www.blokhin.ru/korrektsiya_soskov.php,"На сегодняшний день","коррекция сосков","проводится путем осуществления небольших разрезов на внешнем кольце ареолы, посредством","Dofollow, Content",,"2020-06-07 05:15:20","2020-06-07 05:15:20",,ru,0,0,,3
113,5,30,8,0,http://популярная-медицина.рф/операции-в-интимной-зоне,"Операции в интимной зоне | Популярная Медицина",63,12,http://www.blokhin.ru/intim-hirurg.php,"на операцию, необходимо проконсультироваться у специалиста. Опытный врач знает, что","интимная хирургия","требует такой же аккуратности и ответственности, как и любая другая","Dofollow, Content",,"2016-03-16 18:14:17","2020-05-08 22:30:23",,ru,0,0,,2
114,5,30,8,0,http://популярная-медицина.рф/операции-в-интимной-зоне,"Операции в интимной зоне | Популярная Медицина",63,12,http://www.blokhin.ru/plastika-vlagalisha.php,"отношениях. Ушивание позволяет быстро привести в норму органы. Чаще всего","пластика влагалища","проводится по показаниям врача или по желанию пациента.","Dofollow, Content",,"2016-03-16 18:14:17","2020-05-08 22:30:23",,ru,0,0,,2
115,4,31,8,0,http://betops.info/?c=457&o=&start=7,"Народная и нетрадиционная медицина / Каталог сайтов",42,19,http://www.blokhin.ru/,,"абдоминопластика, пластическая хирургия",,"Dofollow, Content",,"2020-06-03 03:02:14","2020-06-03 03:02:14",,ru,0,0,,14
116,1,31,8,0,http://betops.info/jump.php?28941,,0,1,http://www.blokhin.ru/,,,,"Dofollow, Redirect",,"2020-03-25 10:32:00","2020-06-02 23:12:46",,,0,0,,1
117,16,27,8,0,http://www.slv.kiev.ua/?c=0&o=1&start=557,"Каталог сайтов",222,13,http://www.blokhin.ru/,,http://www.blokhin.ru/,,"Dofollow, Content",,"2019-04-01 21:46:54","2020-04-25 05:45:27",,ru,0,0,,8
118,4,29,8,0,http://www.prichesok.net/interes-2/krasivyje-jagodicy-za-chas.php,"Красивые ягодицы за час",21,7,http://www.blokhin.ru/endo-yagodic.php,Современное,"эндопротезирование ягодиц","(или хирургическое увеличение) представляет собой операцию с целью придания обозначенной","Dofollow, Content",,"2013-08-09 23:30:07","2020-06-02 17:12:10",,,0,0,,2
119,2,29,8,0,http://www.prichesok.net/interes-2/krasivyje-jagodicy-za-chas.php,"Красивые ягодицы за час",21,7,http://www.blokhin.ru/,"После того, как","пластический хирург","дал ""добро"" на операцию, вместе с пациенткой выбирается пара имплантатов,","Dofollow, Content",,"2013-08-09 23:30:07","2020-06-02 17:12:10",,,0,0,,2
120,5,30,8,0,https://psyonline.ru/article/medicine2/76881/,"Статьи. Медицина - 2. Бодилифтинг: показания, противопоказания",72,15,http://www.blokhin.ru/bodylift.php,"кожи на различных участках тела после снижения веса. Как правило,",бодилифтинг,"носит характер эстетической коррекции деформаций фигуры, в том числе и","Dofollow, Content",,"2018-05-30 02:17:30","2020-06-13 10:57:17",,ru,0,0,,6
121,5,30,8,0,https://psyonline.ru/article/medicine2/76881/,"Статьи. Медицина - 2. Бодилифтинг: показания, противопоказания",72,15,http://www.blokhin.ru/liposaktsiya_beder.php,"удаляют лишний жир и кожу с ягодиц. Очень часто требуется","липосакция бедер","и живота. После резкого похудения требуется подтяжка кожи спины, а","Dofollow, Content",,"2018-05-30 02:17:30","2020-06-13 10:57:17",,ru,0,0,,6
122,3,29,8,0,http://kxk.ru/procomp/v1_1792847_1.php,помогите,16,1,https://blokhin.ru/,"каждого кому-то нравится силиконовая грудь кому-то нет. Ей главное выбрать","лучшего пластического хирурга",", который сможет сделать идеальную грудь.","Dofollow, Content",,"2019-06-28 18:17:09","2020-06-13 22:20:48",,ru,0,0,,1
123,1,26,8,0,https://www.tehnologia.info/forum/viewtopic.php?f=9&t=15247&view=next,"www.tehnologia.info - Просмотр темы - Подскажите",26,10,https://blokhin.ru/,"Могу Вам посоветовать","лучшего пластического хирурга","в Росси. Этот врач установил самый первый имплант в ССР.",Dofollow,,"2019-06-05 23:09:05","2020-01-24 09:58:03",,ru,0,0,,5
124,2,29,8,0,http://xzaa.ru/city-379/site/1/246.html,"Клиника пластической хирургии Блохина Н. С. - Публикации - Косметология - Москва - Каталог сайтов XZaa.ru",12,2,http://blokhin.ru/,,http://blokhin.ru/,,"Dofollow, Content",,"2016-10-19 07:09:46","2020-06-13 19:20:17",,ru,0,0,,1
125,1,29,8,0,http://xzaa.ru/go.php?id=742&url=http://blokhin.ru/,,0,1,http://blokhin.ru/,,,,"Dofollow, Redirect",,"2020-04-09 01:42:29","2020-05-30 03:19:18",,,0,0,,1
126,1,29,8,0,https://med-heal.ru/archives/23254,"Пластика сосков у доктора Блохина: внимание к деталям | Медицина и наука",32,10,https://blokhin.ru/services/plastika-areoly-i-soskov/,К,"пластике сосков","и ареол прибегают и женщины, и мужчины. Операция выполняется как","Dofollow, Content",,"2020-05-10 12:38:03","2020-06-15 12:25:54",,ru,0,0,,9
127,10,28,8,0,https://doktor77.ru/read-3230.html,"Медицина в Москве. Врачи и больницы Москвы. Медицинские новости.",64,7,http://www.blokhin.ru/services/smas-lifting/,"смотрелось гармонично. В отличие от обычной подтяжки кожи, SMAS-лифтинг (",смотреть,") проводится на мышечных тканях, поэтому полученный эффект останется на","Dofollow, Content",,"2020-04-03 17:29:48","2020-05-29 02:31:58",,ru,0,0,,3
128,4,28,8,0,http://doktor77.ru/viewtopic-11630.html,"Медицина в Москве. Врачи и больницы Москвы. Медицинские новости.",63,5,https://blokhin.ru/services/umenshenie-grudi/,"за плечами которого десятки успешных операций, в том числе и","пластика тубулярной груди",". И в ближайшем будущем я планирую записаться к нему","Dofollow, Content",,"2019-06-12 02:24:33","2020-06-14 07:15:09",,ru,0,0,,4
129,10,27,8,0,https://www.m.baby-country.ru/forum/topic.php?forum=21&topic=2226,"Уменьшение груди :: БэбиКантри.ru",35,3,https://blokhin.ru/services/umenshenie-grudi/,"Доктор согласился оперировать и в последствии успешно провел операцию по","уменьшению груди",". Решать конечно только вашей сестре, но я бы советовала",Dofollow,,"2019-06-02 14:12:25","2020-04-22 15:47:21",,,0,0,,2
130,2,28,8,0,https://newsplastic.ru/bloxin-sergej-nikolaevich/,"Блохин Сергей Николаевич - Отзывы",76,10,http://www.blokhin.ru/,Сайт:,www.blokhin.ru,,"Nofollow, Content",,"2018-07-30 08:18:27","2020-06-06 16:43:59",,ru,0,0,,6
131,17,27,7,0,http://slv.kiev.ua/?c=0&o=&start=2373,"Каталог сайтов",222,18,http://www.blokhin.ru/,,"абдоминопластика, пластическая хирургия",,"Dofollow, Content",,"2020-06-11 11:52:10","2020-06-11 11:52:10",,ru,0,0,,13
132,1,27,7,0,http://slv.kiev.ua/jump.php?28941,,0,1,http://www.blokhin.ru/,,,,"Dofollow, Redirect",,"2020-06-02 12:41:24","2020-06-02 12:41:24",,,0,0,,1
133,6,27,7,0,http://estetmedicina.ru/estetika/glavnaya-tema/korrektsiya-tubulyarnoy-grudi/,"Коррекция тубулярной груди | Интернет-журнал Estetmedicina.ru",110,8,http://blokhin.ru/tubulyarnaya_grud.php,,"коррекция тубулярной груди",,"Nofollow, Content",,"2020-06-07 03:33:36","2020-06-07 03:33:36",,ru,0,0,,5
134,5,27,7,0,http://women-on-line.ru/news/chek_lifting_osobennosti_pokazanija_protivopokazanija/2012-08-03-1047,"Чек-лифтинг: особенности, показания, противопоказания - 3 Августа 2012",37,11,http://www.blokhin.ru/cheek-lifting.php,"Как и любая пластическая операция,",чек-лифтинг,"откладывается на неопределенное время или вовсе не осуществляется при:","Dofollow, Content",,"2014-09-09 02:44:30","2020-05-31 08:13:51",,ru,0,0,,2
135,5,27,7,0,http://women-on-line.ru/news/chek_lifting_osobennosti_pokazanija_protivopokazanija/2012-08-03-1047,"Чек-лифтинг: особенности, показания, противопоказания - 3 Августа 2012",37,11,http://www.blokhin.ru/plastika-skul.php,"Скорректировать зону средней части можно с помощью более классических способов:","пластика скул",", уменьшение или увеличение щек, круговая подтяжка лица - все","Dofollow, Content",,"2014-09-09 02:44:30","2020-05-31 08:13:51",,ru,0,0,,2
136,5,11,7,0,http://womantalks.ru/topic/1037-verhnyaya-blefaroplastika-pri-navisanii-veka/,"Верхняя блефаропластика при нависании века - 2016 - Женский форум WomanTalks",23,13,http://www.blokhin.ru/navisanie_veka.php,"подкожно-жировой клетчатки и действия гравитационной силы. Первым зачастую оказывается заметно","нависание века",", которое обычно носит двусторонний характер.",Dofollow,,"2016-03-15 01:58:25","2020-04-20 08:47:14",,ru,0,0,,4
137,5,11,7,0,http://womantalks.ru/topic/1037-verhnyaya-blefaroplastika-pri-navisanii-veka/,"Верхняя блефаропластика при нависании века - 2016 - Женский форум WomanTalks",23,13,http://www.blokhin.ru/services/plastika-verhnih-vek/,"Достойной альтернативой этому является","верхняя блефаропластика",". Операция заключается в удалении лишнего количества кожи и жировых",Dofollow,,"2020-03-20 04:57:38","2020-04-20 08:47:14",,ru,0,0,,4
138,10,29,7,0,http://rusmedserver.ru/lechenie_bolezney/Lechenie-ptoza.html,"Лечение птоза",33,8,http://www.blokhin.ru/obvisshaya_grud.php,"В результате постоянной нагрузки происходит снижение эластичности. В таком случае","обвисшая грудь","может быть даже в молодом возрасте.",Dofollow,,"2020-05-30 03:50:33","2020-05-30 03:50:33",,,0,0,,2
139,4,29,7,0,http://rusmedserver.ru/lechenie_bolezney/Lechenie-ptoza.html,"Лечение птоза",33,8,http://www.blokhin.ru/,"Компетентный,","лучший хирург по пластике Блохин","способен выполнить ареолярную технику. Операция требует максимальной точности, ведь доступ",Dofollow,,"2020-05-30 03:50:33","2020-05-30 03:50:33",,,0,0,,2
140,4,28,7,0,http://mozhaysk.ru/index.php?tp=repl04&id=2552,"Можайск - Общественный сайт Можайска и Можайского района. Страница отзывов в Разное",285,6,"https://blokhin.ru/services/podtjazhka-i-uvelichen ie-grudi/","Всегда мечтала сделать","подтяжку с увеличением","груди, но как-то страх меня останавливал. Но в один прекрасный",Dofollow,,"2020-06-12 00:24:39","2020-06-12 00:24:39",,ru,0,0,,5
141,10,25,7,0,http://www.izkis.ru/articles.php?id=288,"Опрелости под грудью. Что делать?",37,6,http://www.blokhin.ru/services/umenshenie-grudi/,"язвы увеличиваются в размерах. Радикальным решением проблемы может стать хирургическое","уменьшение груди",". Пластическая операция, именуемая редукционной маммопластикой, позволит придать молочным железам","Dofollow, Content",,"2020-04-08 19:46:43","2020-04-15 15:16:41",,,7,10,,2
142,5,26,7,0,http://ledilana.ru/post331482768/,"Подтяжка лица. Обсуждение на LiveInternet - Российский Сервис Онлайн-Дневников",174,181,http://www.blokhin.ru/plast-lica.php,"При обнаружении данных признаков многие женщины делают выбор -","подтяжка лица","и вечная молодость или же старость и потеря привлекательности.","Dofollow, Content",,"2019-04-20 13:52:22","2020-04-24 18:20:57",,ru,0,0,,12
143,5,26,7,0,http://ledilana.ru/post331482768/,"Подтяжка лица. Обсуждение на LiveInternet - Российский Сервис Онлайн-Дневников",174,181,http://www.blokhin.ru/podtazhka-lba.php,"в области бровей и лба. Именно к данной категории относится","подтяжка лба",", которую проводят за счет нанесения разреза на волосяной части","Dofollow, Content",,"2019-04-20 13:52:22","2020-04-24 18:20:57",,ru,0,0,,12
144,2,26,7,0,http://www.iwoman.ru/Subjects-index-req-viewpage-pageid-7275.html,"Как проводится абдоминопластика?",71,4,http://www.blokhin.ru/,"качестве оперативного способа лечения ожирения (читать подробнее по ссылке ""","абдоминопластика москва","""). Хирургическое лечения ожирения сводится обычно к бандажированию желудка или","Dofollow, Content",,"2020-06-07 16:17:49","2020-06-07 16:17:49",,ru,0,0,,3
145,10,26,7,0,http://www.krasotaizdorovie.ru/articles/plasticheskaya-hirurgiya-pomozhet-v-borbe-so-stareniem.php,"Пластическая хирургия поможет в борьбе со старением",61,7,http://www.blokhin.ru/plast-lica.php,"эффекта. И единственным способом достичь его является подтяжка лица (перейти по ссылке",подтяжка,"лица москва ).","Dofollow, Content",,"2014-06-27 16:37:38","2020-05-31 13:07:38",,,0,0,,1
146,4,26,7,0,http://www.krasotaizdorovie.ru/articles/plasticheskaya-hirurgiya-pomozhet-v-borbe-so-stareniem.php,"Пластическая хирургия поможет в борьбе со старением",61,7,http://www.blokhin.ru/,"объявления о различных акциях на операцию по коррекции формы и размера молочных желез. В Интернете","пластика груди москва","— один из самых популярных запросов. Все это свидетельствует о неспадающем интересе","Dofollow, Content",,"2014-06-27 16:37:38","2020-05-31 13:07:38",,,0,0,,1
147,2,25,7,0,http://otvet.expert/uvelichenie-grudi-1542289,"Увеличение Груди",17,3,https://blokhin.ru/services/uvelichenie-grudi/,"несу ответственность за него). По множеству положительных отзывов решилась на","увеличение груди","в клинике FrauKlinik у Сергея Николаевича Блохина. Операция длилась всего","Dofollow, Content",,"2019-06-08 03:30:28","2020-06-15 11:48:48",,ru,0,0,,2
148,5,24,7,0,http://www.mamashkam.ru/poleznosti/tovari_uslugi_dlya_detey_roditeley/chjek-lifting-i-podtjazhka-lba--kak-sokhranit-moloduju-kozhu.html,"Чек-лифтинг и подтяжка лба – как сохранить молодую кожу?",91,15,http://www.blokhin.ru/cheek-lifting.php,"Для борьбы с такими проблемами кожи разработан специальный метод –",чек-лифтинг,". Это специальная комплексная процедура, при которой проводят блефаропластику, пластику скул","Dofollow, Content",,"2013-08-09 16:41:06","2020-05-30 16:29:05",,ru,0,0,,4
149,5,24,7,0,http://www.mamashkam.ru/poleznosti/tovari_uslugi_dlya_detey_roditeley/chjek-lifting-i-podtjazhka-lba--kak-sokhranit-moloduju-kozhu.html,"Чек-лифтинг и подтяжка лба – как сохранить молодую кожу?",91,15,http://www.blokhin.ru/podtazhka-lba.php,"усталый и измученный вид лица. Чтобы избавиться от этого, используется","подтяжка лба",.,"Dofollow, Content",,"2013-08-09 16:41:06","2020-05-30 16:29:05",,ru,0,0,,4
150,5,19,7,0,http://super-lady.ru/publ/1-1-0-2120,"Эндопротезирование груди",42,15,http://www.blokhin.ru/grud_raznogo_razmera.php,"400 мл. Подобное разнообразие позволяет устранить косметический дефект, когда отмечается","грудь разного размера",", так называемая асимметрия.","Dofollow, Content",,"2018-04-25 04:59:12","2020-05-27 03:12:43",,ru,0,0,,5
151,5,19,7,0,http://super-lady.ru/publ/1-1-0-2120,"Эндопротезирование груди",42,15,http://www.blokhin.ru/endoprotezirovanie-grudi.php,"Безусловно,","эндопротезирование груди","предполагает вживление в ткани имплантатов. Сегодня в медицинской практике применяется","Dofollow, Content",,"2018-04-25 04:59:12","2020-05-27 03:12:43",,ru,0,0,,5
152,5,19,7,0,http://super-lady.ru/publ/4-1-0-1720,"Сохранение молодости и красоты после 30 лет",44,15,http://www.blokhin.ru/blefaroplastika.php,"так уж и сложно, нужно просто правильно это делать, и",блефаропластика,"(пластика век) вам не понадобится очень долго. Это важно, потому","Dofollow, Content",,"2013-08-11 02:17:59","2020-06-15 12:06:12",,ru,0,0,,5
153,5,19,7,0,http://super-lady.ru/publ/4-1-0-1720,"Сохранение молодости и красоты после 30 лет",44,15,http://www.blokhin.ru/otoplastika.php,"ушей и т.д.). Сегодня пластические хирурги могут творить чудеса. Например,",отопластика,"поможет исправить форму ушных раковин. Эстетический тип этой операции подразумевает","Dofollow, Content",,"2013-08-11 02:17:59","2020-06-15 12:06:12",,ru,0,0,,5
154,2,21,7,0,https://www.trkr.ru/plastic/klinika-plasticheskoy-hirurgii-doktora-blohina.html,"Клиника пластической хирургии Доктора Блохина - отзывы, услуги, адрес, телефон - TRKR.RU",32,8,http://www.blokhin.ru/,"+7(495) 585-70-51",http://www.blokhin.ru,,Dofollow,,"2019-04-09 02:44:37","2020-05-06 12:44:25",,ru,0,0,,6
155,2,21,7,0,https://www.trkr.ru/plastic/blohin-sergey-nikolaevich.html,"Блохин Сергей Николаевич - отзывы, услуги, адрес, телефон - TRKR.RU",32,8,http://www.blokhin.ru/,"+7 (925) 585-70-51",http://www.blokhin.ru,,"Dofollow, Content",,"2019-04-03 11:37:59","2020-05-02 09:01:37",,ru,0,0,,6
156,9,2,7,1,http://vseofitnese.ru/forum/posts/detail/1459/1891/all/20,"Форум / Пластическая хирургия / Общие вопросы пластической хирургии / Пугающие сайты пластических хирургов.",80,43,http://www.blokhin.ru/,-,www.blokhin.ru,,"Dofollow, Content",,"2018-05-06 04:33:20","2020-04-15 02:14:46",,ru,0,0,,7
157,4,17,7,0,http://doublex.ru/blog/style/3338.html,"Пластика груди - Стиль жизни - Интернет-журнал для женщин DoubleX",96,16,http://blokhin.ru/mammoplastica.php,,Маммопластика,"может быть назначена врачом в следующих случаях:","Dofollow, Content",,"2019-06-30 08:31:51","2020-01-23 12:05:47",,ru,0,0,,9
158,5,16,7,0,http://good-medic.ru/medicinskie-novosti/uvelichenie-i-umen-shenie-grudi-chto-predlagayut-hirurgi.html,"Увеличение и уменьшение груди: что предлагают хирурги? - Медицинская энциклопедия от А до Я old",180,12,http://www.blokhin.ru/services/umenshenie-grudi/,Проводится,"уменьшение груди","одним из трех методов. В случае гигантомастии у мужчин, для",Dofollow,,"2020-04-15 19:36:34","2020-04-15 19:36:34",,ru,0,0,,3
159,5,16,7,0,http://good-medic.ru/medicinskie-novosti/uvelichenie-i-umen-shenie-grudi-chto-predlagayut-hirurgi.html,"Увеличение и уменьшение груди: что предлагают хирурги? - Медицинская энциклопедия от А до Я old",180,12,http://www.blokhin.ru/endoprotezirovanie-grudi.php,Осуществляется,"протезирование (эндопротезирование) груди","одним из двух методов. В первом случае имплантат помещается под",Dofollow,,"2014-04-03 22:16:45","2020-04-15 19:36:34",,ru,0,0,,3
160,5,24,7,0,https://zdravo2020.ru/zdorove/zdorove-zhenshchiny/v-zhenshhine-glavnoe-yagodicy.html,"В женщине главное ягодицы?!",32,10,http://www.blokhin.ru/gluteo.php,"Пластика ягодиц (",глютеопластика,") подразумевает под собой их увеличение с помощью специальных имплантов.","Dofollow, Content",,"2019-09-25 20:14:20","2020-05-31 19:07:28",,ru,0,0,,2
161,4,24,7,0,https://zdravo2020.ru/zdorove/zdorove-zhenshchiny/v-zhenshhine-glavnoe-yagodicy.html,"В женщине главное ягодицы?!",32,10,http://www.blokhin.ru/,"Глютеопластика – быстрый способ сделать","плоские ягодицы","округлыми и красивыми, победив таким образом свою генетику! Ведь не","Dofollow, Content",,"2020-03-11 21:10:03","2020-05-31 19:07:28",,ru,0,0,,2
