#,"Total Backlinks","Domain Rating","URL Rating (desc)","Referring Domains","Referring Page URL","Referring Page Title","Internal Links Count","External Links Count","Link URL",TextPre,"Link Anchor",TextPost,Type,"Backlink Status","First Seen","Last Check","Day Lost",Language,Traffic,Keywords,"Js rendered","Linked Domains"
578,3,20,7,0,https://nashchelyabinsk.ru/post/federalnyi-nauchno-klinicheskii-tsentr-fmba-rossii/,"Федеральный научно-клинический центр ФМБА России поделится опытом в лечении новообразований молочной железы — Наш Челябинск",46,9,http://fnkc-fmba.ru/sobytiya/,"Регистрация на семинар на сайте",https://fnkc-fmba.ru/aktsii/otkrytyy-seminar-dlya-zhenshchin-po-onkologicheskim-zabolevaniya-molochnoy-zhelezy/,,"Nofollow, Content",,"2020-03-04 15:26:03","2020-04-16 12:41:10",,ru,0,0,,6
579,1,20,7,0,https://nashchelyabinsk.ru/post/7-fevralia-sostoitsia-konkurs-manualnykh-navykov-o/,"7 февраля состоится конкурс мануальных навыков, организованный ФНКЦ ФМБА России — Наш Челябинск",46,7,https://fnkc-fmba.ru/sobytiya/prekurs-khirurgiya-pakhovykh-gryzh/,"Более подробная информация на сайте",https://fnkc-fmba.ru/sobytiya/prekurs-khirurgiya-pakhovykh-gryzh/,,"Nofollow, Content",,"2019-02-11 20:39:34","2020-04-16 15:40:02",,ru,0,0,,6
580,1,20,7,0,https://nashchelyabinsk.ru/post/8-fevralia-sostoitsia-nauchno-prakticheskaia-konfe/,"8 февраля состоится научно-практическая конференция «Эндовидеохирургия паховых грыж», организованный ФНКЦ ФМБА России — Наш Челябинск",46,7,https://fnkc-fmba.ru/sobytiya/endovideokhirurgiya-pakhovykh-gryzh/,"Более подробная информация на сайте",https://fnkc-fmba.ru/sobytiya/endovideokhirurgiya-pakhovykh-gryzh/,,"Nofollow, Content",,"2019-02-11 21:24:48","2020-04-14 18:26:23",,ru,0,0,,6
581,1,20,7,0,https://nashchelyabinsk.ru/post/v-ialte-sostoitsia-nauchno-prakticheskaia-konferen/,"В Ялте состоится научно-практическая конференция КАРДИОКРЫМ-2018 — Наш Челябинск",46,7,https://fnkc-fmba.ru/sobytiya/kardiokrym-2018/,"Resort & SPA . Регистрация на мероприятие доступна по ссылке:",https://fnkc-fmba.ru/sobytiya/kardiokrym-2018/,,"Nofollow, Content",,"2018-12-12 02:53:57","2020-04-16 20:46:26",,ru,0,0,,6
582,1,20,7,0,https://news.immitate.com/2020/05/06/russian-coronavirus-doctors-are-mysteriously-falling-out-of-windows-vox-com/,"Russian coronavirus doctors are mysteriously falling out of windows - Vox.com | Global News Archive",71,32,https://fnkc-fmba.ru/news/kollektiv-fnkts-fmba-rossii-vyrazhaet-soboleznovaniya/,"hospital where she died releasing a statement saying she “","died tragically","” in an “ accident ,” with no additional details","Dofollow, Content",,"2020-05-12 15:44:11","2020-06-12 02:14:28",,en,0,0,,24
583,2,13,7,0,http://sonya-kot.ru/post421622561/,"Где сделать МРТ позвоночника в Москве?. Обсуждение на LiveInternet - Российский Сервис Онлайн-Дневников",48,54,https://fnkc-fmba.ru/diagnostika/magnitno-rezonansnaya-tomografiya/mrt-pozvonochnika/,"заболеваний различных систем и органов. В том числе применяется и","МРТ позвоночника","- как всего полностью, так и отдельных его сегментов (шейного,","Dofollow, Content",,"2017-09-21 05:31:32","2020-04-03 06:34:37",,ru,0,0,,5
584,8,18,7,0,http://wmw.ru/archive/index.php?ELEMENT_ID=4967,"Клиническая больница № 83 ФМБА России",11,4,http://fnkc-fmba.ru/,"Продвижение Интернет-сайта больницы",kb83.com,"в поисковых системах Yandex, Google и Rambler","Dofollow, Content",,"2019-04-17 17:43:09","2020-04-16 02:26:49",,ru,0,0,,3
585,4,19,7,0,http://labexch.ru/vacancy/?action=read2&id=1283583,"Вакансия: Санитар для транспортировки пациентов, Москва, ФГБУ ФНКЦ специализированных видов медицинской помощи и медицинских технологий ФМБА России на сайте Электронной Биржи труда г. Москва",76,27,http://fnkc-fmba.ru/,,fnkc-fmba.ru,,"Nofollow, Content",,"2020-04-22 21:07:59","2020-04-22 21:07:59",,ru,0,0,,13
586,14,17,7,0,http://radaris.ru/p/Юрий/Оболонков/,"Radaris Россия: Поиск Юрий Оболонков? Поиск людей. Найдите публичные записи с помощью лидирующего сайта для поиска людей.",77,47,http://fnkc-fmba.ru/pages/rec.php,,"Запись на прием к врачу ...",,Nofollow,,"2018-04-23 13:37:16","2020-04-27 06:23:01",,,0,0,,17
587,8,17,7,0,http://radaris.ru/p/Юлия/Лебенкова/,"Radaris Россия: Поиск Юлия Лебенкова? Сайт Радарис номер 1 источник поиска информации. Лучшие записи поиска людей в СНГ.",77,47,http://fnkc-fmba.ru/pages/shed.php,,"Клиническая Больница №83 ...",,Nofollow,,"2018-04-25 00:48:51","2020-04-13 05:52:09",,,0,0,,13
588,2,21,7,0,https://pharm-sintez.ru/en/partners.html,"Partners | Фарм-Синтез",11,63,http://fnkc-fmba.ru/,,"Federal Research and Clinical Center Federal Biomedical Agency of Russia (Federal State Budgetary Institution)",,Dofollow,,"2020-06-08 17:11:57","2020-06-08 17:11:57",,en,0,4,,39
589,6,13,7,0,http://www.olig.ru/forums/lofiversion/index.php/t579047-0.html,"Все форумы > MALDI-TOF, идентификация бактерий",20,12,https://fnkc-fmba.ru/,,https://fnkc-fmba.ru/,,"Dofollow, Content",,"2017-08-30 20:49:11","2020-05-06 09:37:25",,,0,0,,4
590,2,1,7,2,http://www.whenregistered.com/domain-list-634,"Alexa top domain list || page 634",586,919,http://fnkc-fmba.ru/,,fnkc-fmba.ru,,Nofollow,,"2020-02-21 23:14:51","2020-05-15 09:14:52",,en,0,0,,590
591,1,20,7,0,https://1045freshradio.ca/news/6905454/coronavirus-russia-doctors-windows/,"3 Russian doctors have fallen from hospital windows amid COVID-19 pandemic: reports | 104.5 Fresh Radio",44,89,https://fnkc-fmba.ru/news/kollektiv-fnkts-fmba-rossii-vyrazhaet-soboleznovaniya/,"called her death an “accident” in a statement also shared","on the training centre’s website.",,"Dofollow, Content",,"2020-06-13 02:58:33","2020-06-13 02:58:33",,en,0,0,,18
592,1,18,7,0,https://alexpresents.com/2020/05/04/three-russian-doctors-have-fallen-out-of-windows-in-just-over-a-week/,"Three Russian Doctors Have Fallen Out Of Windows In Just Over A Week | AlexPresents",19,26,https://fnkc-fmba.ru/news/kollektiv-fnkts-fmba-rossii-vyrazhaet-soboleznovaniya/,"a result of an accident,” according to a Moscow hospital",statement,". She had been hospitalized with COVID-19.","Nofollow, Content",,"2020-05-08 01:56:45","2020-06-08 18:44:51",,en,0,0,,18
593,2,17,7,0,http://ukrainepress.ru/archives/56825,"Продукты-антиэнергетики | Последние новости украины сегодня свежие новости дня украины онлайн",41,7,http://fnkc-fmba.ru/pages/priem.php,"Помимо обычной скорой помощи, вам на помощь может приехать","платная скорая помощь",", где также работают прекрасные специалисты. На платной скорой помощи","Dofollow, Content",,"2019-08-27 06:27:25","2020-06-04 19:04:45",,ru,0,0,,5
594,4,13,7,0,https://serebryaniy-bereg.ru/kak-delayut-mrt-poyasnichnogo-otdela/,"как делают мрт поясничного отдела – serebryaniy-bereg.ru",34,104,https://fnkc-fmba.ru/images/mrt_poyasnichnogo_otdela_pozvonochnika.jpg,,,,"Dofollow, Image, Content",,"2020-02-15 06:49:12","2020-02-15 06:49:12",,en,0,0,,72
595,2,19,7,0,http://aliveforfootball.com/2020/05/three-doctors-with-covid-19-mysteriously-fall-from-hospital/,"Three Doctors With COVID-19 Mysteriously Fall From Hospital Windows",36,12,https://fnkc-fmba.ru/news/kollektiv-fnkts-fmba-rossii-vyrazhaet-soboleznovaniya/,"town of Zvyozdny nearMoscow, died in what aMoscowhospital called ""","an accident",""".","Dofollow, Content",,"2020-05-12 13:56:25","2020-06-12 01:30:35",,en,0,0,,7
596,8,16,7,0,https://fitsport.ru/fm/lofiversion/index.php/t11014-50.html,"Форум fitsport.ru > сердце",65,13,http://fnkc-fmba.ru/,,http://www.kb83.com/,,Dofollow,,"2018-07-10 00:50:28","2020-04-24 18:45:54",,,0,3,,11
597,6,13,7,0,https://serebryaniy-bereg.ru/test-na-besplodie-u-muzhchin-tsena/,"тест на бесплодие у мужчин цена – serebryaniy-bereg.ru",31,106,https://fnkc-fmba.ru/upload/LechenieBesplodia_1110px.png,,"~image credit",,"Dofollow, Image, Content",,"2020-02-13 01:15:35","2020-02-13 01:15:35",,sl,0,0,,71
598,6,17,7,0,http://clinpractice.ru/news/500/,"Новости медицины",31,7,http://fnkc-fmba.ru/wp-content/uploads/2016/01/Endouzi-kartinka-e1453822341920.jpg,,"Эндоузи картинка","В ходе семинара продемонстрированы новейшие возможности эндосонографии средостения: эластография, режим","Dofollow, Image, Content",,"2018-04-26 00:02:44","2020-04-29 14:55:44",,,0,0,,4
599,6,17,7,0,http://clinpractice.ru/news/525/,"Новости медицины",31,7,http://fnkc-fmba.ru/sobytiya/trudnyy-diagnoz-pri-boleznyakh-organov-dykhaniya/,,"Программа конференции «Трудный диагноз при болезнях органов дыхания»",,Dofollow,,"2020-04-04 16:43:42","2020-04-11 03:17:55",,,0,0,,4
600,6,17,7,0,http://clinpractice.ru/news/497/,"Новости медицины",31,7,http://fnkc-fmba.ru/wp-content/uploads/2015/12/YjcYFA8QGxU.jpg,:,YjcYFA8QGxU,,"Dofollow, Image, Content",,"2020-04-06 11:40:43","2020-04-12 10:37:13",,,0,0,,4
601,3,17,7,0,http://clinpractice.ru/news/495/,"Новости медицины",31,6,http://fnkc-fmba.ru/?p=4947,"Подробную информацию об услугах и стоимости работ вы найдёте в","разделе эстетической хирурга",.,"Dofollow, Content",,"2020-04-04 17:47:58","2020-04-10 20:40:38",,,0,0,,4
602,6,17,7,0,http://clinpractice.ru/news/491/,"Новости медицины",31,7,http://fnkc-fmba.ru/wp-content/uploads/2015/11/Screenshot_1-e1448567647194.png,,Screenshot_1,,"Dofollow, Image, Content",,"2018-05-02 23:46:24","2020-04-21 10:25:55",,,0,0,,4
603,4,19,7,0,http://gazeta-novosti-zyablikovo.ru/2017/11/02/33133/,"Специалист из медицинского центра в Зябликове принял участие в мастер-классе в МГУ | Новости Зябликово",49,20,https://fnkc-fmba.ru/,Фото:,"ФНКЦ ФМБА",,Dofollow,,"2017-11-05 02:50:44","2020-05-28 03:27:36",,ru,0,0,,11
604,3,19,7,0,http://gazeta-novosti-zyablikovo.ru/2017/03/23/26384/,"Врач из Зябликова принял участие в окружной научной конференции | Новости Зябликово",49,21,http://fnkc-fmba.ru/,Фото:,"официальный сайт ФНКЦ ФМБА",,Dofollow,,"2017-03-29 21:27:55","2020-05-27 15:22:36",,ru,0,0,,11
605,2,19,7,0,http://gazeta-novosti-zyablikovo.ru/2017/02/09/24988/,"«Культпоход»: какие мероприятия пройдут в районе в ближайшие семь дней | Новости Зябликово",49,23,http://fnkc-fmba.ru/sobytiya/sovremennoe-lechenie-ginekologicheskikh-bolnykh-s-izbytochnoy-massoy-tela/,"Вход: свободный (требуется регистрация","по ссылке",),"Dofollow, Content",,"2017-02-19 22:11:39","2020-05-29 06:36:46",,ru,0,0,,12
606,2,19,7,0,http://gazeta-novosti-zyablikovo.ru/2017/03/09/25900/,"«Культпоход»: какие мероприятия ждут жителей района на ближайшей неделе | Новости Зябликово",49,21,http://fnkc-fmba.ru/sobytiya/trudnyy-diagnoz-pri-boleznyakh-organov-dykhaniya/,"Вход: свободный (необходима регистрация по",ссылке,),"Dofollow, Content",,"2017-03-14 08:05:24","2020-05-29 06:37:05",,ru,0,0,,11
607,2,19,7,0,http://gazeta-novosti-zyablikovo.ru/2017/03/24/26446/,"Научно-клинический центр включили в престижное Европейское исследование | Новости Зябликово",50,21,http://fnkc-fmba.ru/news/,"сердечно-сосудистых заболеваний, ведения пациентов и результатов лечения», — говорится на",сайте,"медицинского учреждения.","Dofollow, Content",,"2017-03-29 11:43:35","2020-05-27 14:44:20",,ru,0,0,,11
608,2,19,7,0,http://gazeta-novosti-zyablikovo.ru/2017/04/19/27369/,"Новые технологии в неврологии обсудят в Научно-клиническом центре на Ореховом бульваре | Новости Зябликово",49,21,http://fnkc-fmba.ru/sobytiya/novye-tekhnologii-v-nevr..,"Зарегистрироваться и посмотреть подробную программу конференции можно","по ссылке",.,"Dofollow, Content",,"2017-04-21 00:04:26","2020-05-26 21:19:15",,ru,0,0,,11
609,1,19,7,0,http://gazeta-novosti-zyablikovo.ru/2017/11/30/33844/,"Специалисты научно-клинического центра выступили на форуме в Сибири | Новости Зябликово",49,20,https://fnkc-fmba.ru/,Фото:,"ФНКЦ ФМБА России",,Dofollow,,"2017-12-07 02:37:50","2020-05-25 12:40:44",,ru,0,0,,11
610,1,19,7,0,http://gazeta-novosti-zyablikovo.ru/2018/11/15/44539/,"«День донора»: зябликовцы могут помочь врачам спасти другие жизни | Новости Зябликово",50,20,https://fnkc-fmba.ru/news/den-donora-v-fnkts-fmba-rossii-odin-litr-krovi-neskolko-spasennykh-zhizney/,"важно не навредить и своему организму», – сообщается на официальном",сайте,"учреждения здравоохранения.","Dofollow, Content",,"2018-11-24 10:09:21","2020-05-26 19:36:26",,ru,0,0,,11
611,1,19,7,0,http://gazeta-novosti-zyablikovo.ru/2019/01/02/46731/,"Январские каникулы: как работает Федеральный научно-клинический центр в новогодние праздники | Новости Зябликово",48,21,https://fnkc-fmba.ru/news/grafik-raboty-fgbu-fnkts-fmba-rossii-v-vykhodnye-i-nerabochie-prazdnichnye-dni/,"ФМБА) России в новогодние праздники. Об этом сообщается на официальном",сайте,"медицинского учреждения.","Dofollow, Content",,"2019-01-04 19:52:54","2020-05-24 21:06:53",,ru,0,0,,11
612,1,19,7,0,http://gazeta-novosti-zyablikovo.ru/2019/02/04/47915/,"Сердечно-сосудистые заболевания: «День здоровья» проведут в Федеральном научно-клиническом центре | Новости Зябликово",48,21,https://fnkc-fmba.ru/news/priglashaem-na-den-zdorovya-v-fnkts-fmba-rossii-/,"(ФНКЦ ФМБА) России 18 февраля. Об этом сообщается на официальном",сайте,учреждения.,"Dofollow, Content",,"2019-02-06 16:36:21","2020-05-26 23:09:36",,ru,0,0,,11
613,1,19,7,0,http://gazeta-novosti-zyablikovo.ru/2019/02/15/48394/,"Вижу ясно: жители района бесплатно проверят зрение | Новости Зябликово",50,21,https://fnkc-fmba.ru/news/zhiteli-zyablikovo-smogut-besplatno-proverit-zrenie/,"района 18 и 19 февраля. Об этом сообщается на официальном",сайте,учреждения.,"Dofollow, Content",,"2019-02-17 00:42:51","2020-05-27 00:48:13",,ru,0,0,,11
614,1,19,7,0,http://gazeta-novosti-zyablikovo.ru/2019/03/11/49351/,"«День донора»: акция по безвозмездной сдаче крови пройдет в Зябликове | Новости Зябликово",49,21,https://fnkc-fmba.ru/news/den-donora-v-fnkts-fmba-rossii-odin-litr-krovi-neskolko-spasennykh-zhizney-2019/,"(ФНКЦ) ФМБА России 14 марта. Об этом сообщается на официальном",сайте,учреждения.,"Dofollow, Content",,"2019-03-17 04:33:43","2020-05-26 20:29:35",,ru,0,0,,11
615,1,19,7,0,http://gazeta-novosti-zyablikovo.ru/2019/03/12/49439/,"«День Здоровья – Легкое дыхание»: зябликовцы бесплатно проверят органы дыхания | Новости Зябликово",49,21,https://fnkc-fmba.ru/news/legkoe-dykhanie-besplatnaya-skriningovaya-diagnostika-dykhatelnoy-sistemy-v-fnkts-fmba-rossii/,"пульмонологии ФМБА РФ 13 марта. Об этом сообщается на официальном",сайте,"медицинского учреждения.","Dofollow, Content",,"2019-03-17 08:16:46","2020-05-27 00:46:38",,ru,0,3,,11
616,1,19,7,0,http://gazeta-novosti-zyablikovo.ru/2019/03/22/49858/,"Проверка работы сосудов: «День здоровья» пройдет в Федеральном научно-клиническом центре | Новости Зябликово",47,21,https://fnkc-fmba.ru/news/vse-zhelayushchie-smogut-proverit-rabotu-sosudov-v-ramkakh-aktsii-den-zdorovya-v-fnkts-fmba-rossii/,"могут проверить работу сосудов организма. Об этом сообщается на официальном",сайте,"медицинского учреждения.","Dofollow, Content",,"2019-03-28 20:50:41","2020-05-27 00:43:17",,ru,0,0,,11
617,1,19,7,0,http://gazeta-novosti-zyablikovo.ru/2019/04/03/50336/,"Пиллинг, массаж и гимнастика: дни красоты пройдут на Ореховом бульваре 3 и 4 апреля | Новости Зябликово",48,21,https://fnkc-fmba.ru/news/3-i-4-aprelya-v-fnkts-fmba-rossii-sostoyatsya-dni-krasoty/,"России 3 и 4 апреля. Об этом сообщается на официальном",сайте,"медицинского учреждения.","Dofollow, Content",,"2019-04-14 07:48:04","2020-05-27 12:09:13",,ru,0,0,,11
618,1,19,7,0,http://gazeta-novosti-zyablikovo.ru/2019/04/08/50538/,"Всемирный день здоровья: бесплатные тренировки на тренажере Power Plat пройдут в Зябликове | Новости Зябликово",48,20,https://fnkc-fmba.ru/news/v-chest-prazdnika-vsemirnyy-den-zdorovya-s-8-po-10-aprelya-v-fnkts-fmba-rossii-mozhno-poprobovat-svo/,"с 8 по 10 апреля. Такая информация размещена на официальном",сайте,"медицинского учреждения.","Dofollow, Content",,"2019-04-14 17:34:16","2020-05-27 01:41:04",,ru,0,0,,11
619,1,19,7,0,http://gazeta-novosti-zyablikovo.ru/2019/05/15/52092/,"В клиническом центре Зябликова пройдет «День донора» | Новости Зябликово",47,20,https://fnkc-fmba.ru/news/16-maya-den-donora-v-fnkts-fmba-rossii-vasha-krov-spasyet-zhizn/,"Федеральном научно-клиническом центре 16 мая. Об этом сообщили на официальном",сайте,"медицинской организации.","Dofollow, Content",,"2019-05-25 12:50:50","2020-05-26 20:34:28",,ru,0,0,,11
620,1,19,7,0,http://gazeta-novosti-zyablikovo.ru/2019/05/28/52786/,"Федеральный научно-клинический центр проведет бесплатные обследования в центре Москвы | Новости Зябликово",50,20,https://fnkc-fmba.ru/news/fnkts-fmba-rossii-primet-uchastie-v-vystavke-zdorove-natsii-osnova-protsvetaniya-rossii-kotoraya-pro/,"Как сообщается на официальном",сайте,"медицинского учреждения, желающие бесплатно пройдут комплексное обследование организма. На экспозиции","Dofollow, Content",,"2019-06-06 13:36:21","2020-05-26 15:06:27",,ru,0,2,,11
621,1,19,7,0,http://gazeta-novosti-zyablikovo.ru/2019/06/24/54140/,"Уникальная операция: сразу две опухоли удалили специалисты научно-клинического центра | Новости Зябликово",49,22,https://fnkc-fmba.ru/news/spetsialisty-fnkts-fmba-rossii-proveli-kombinirovannuyu-operatsiyu-na-golovnom-mozge-i-bryushnoy-pol/,"за состоянием здоровья пациентки. Информация об этом размещена на официальном",сайте,учреждения.,"Dofollow, Content",,"2019-06-28 10:40:55","2020-05-27 16:12:49",,ru,0,0,,12
622,1,19,7,0,http://gazeta-novosti-zyablikovo.ru/2019/08/05/56541/,"Консультация у лора: акция «День здоровья» пройдет на Ореховом бульваре | Новости Зябликово",48,21,https://fnkc-fmba.ru/aktsii/den-zdorovya-s-lor-vrachom/,"По информации, размещенной на официальном",сайте,"медицинского учреждения, пациенты получат первичную консультацию, пройдут осмотр ЛОР-органов. А","Dofollow, Content",,"2019-08-08 20:41:59","2020-05-27 00:44:14",,ru,0,0,,11
623,1,19,7,0,http://gazeta-novosti-zyablikovo.ru/2019/10/09/59477/,"Новое направление: «Центр патологии головы и шеи» запустили в ФНКЦ ФМБА России | Новости Зябликово",48,20,https://fnkc-fmba.ru/otdeleniya/khirurgicheskiy-profil/tsentr-patologii-golovy-i-shei/otdelenie-patologii-golovy-i-shei/,"С подробной информацией о новом направлении можно ознакомиться, перейдя по",ссылке,". Напомним, что недавно ФНКЦ принял участие в акции «Неделя","Dofollow, Content",,"2019-10-09 22:29:22","2020-05-27 00:41:10",,ru,0,0,,11
624,1,19,7,0,http://gazeta-novosti-zyablikovo.ru/2019/10/15/59660/,"«Усабрь»: в научно-клиническом центре проведут бесплатную консультацию по вопросам урологии | Новости Зябликово",52,23,https://fnkc-fmba.ru/,"Афиша: официальный",сайт,"ФНКЦ ФМБА России","Dofollow, Content",,"2019-10-21 10:02:45","2020-05-26 22:41:38",,ru,0,0,,12
625,1,19,7,0,http://gazeta-novosti-zyablikovo.ru/2019/10/15/59660/,"«Усабрь»: в научно-клиническом центре проведут бесплатную консультацию по вопросам урологии | Новости Зябликово",52,23,https://fnkc-fmba.ru/news/vserossiyskaya-aktsiya-po-ranney-diagnostike-raka-prostaty-usabr/,"Как сообщается на официальном",сайте,"медицинского учреждения, по ее программе будет организован консультативный день. Заведующий","Dofollow, Content",,"2019-10-21 10:02:45","2020-05-26 22:41:38",,ru,0,0,,12
626,1,19,7,0,http://gazeta-novosti-zyablikovo.ru/2019/10/17/59821/,"Челюстно-лицевой хирург начал принимать пациентов в «Центре патологии головы и шеи» | Новости Зябликово",49,20,https://fnkc-fmba.ru/news/chelyustno-litsevoy-khirurg-v-fnkts-fmba-rossii/,"По информации, размещенной на официальном",сайте,"медицинского учреждения, прием ведет Анна Дудаева. Специалист поможет обратившимся избавиться","Dofollow, Content",,"2019-10-21 01:25:32","2020-05-27 00:18:47",,ru,0,0,,11
627,1,19,7,0,http://gazeta-novosti-zyablikovo.ru/2019/10/22/59943/,"Врач-ортодонт проведет бесплатные консультации в научно-клиническом центре | Новости Зябликово",50,20,https://fnkc-fmba.ru/news/besplatnaya-konsultatsiya-vracha-ortodonta-uspey-zapisatsya/,"Подробно об акции читайте на",сайте,"ФНКЦ ФМБА России. Запись по телефону:8(499)725-44-40. Прием пройдет на 5-м","Dofollow, Content",,"2019-10-25 23:34:26","2020-05-26 21:33:52",,ru,0,1,,11
