#,"Total Backlinks","Domain Rating","URL Rating (desc)","Referring Domains","Referring Page URL","Referring Page Title","Internal Links Count","External Links Count","Link URL",TextPre,"Link Anchor",TextPost,Type,"Backlink Status","First Seen","Last Check","Day Lost",Language,Traffic,Keywords,"Js rendered","Linked Domains"
793,2,3,5,0,http://historyndex.com/page-history/fnkc-fmba-rossii-vystupit-organizatorom-mezhdunarodnoj-konferencii-kardio-2018-7FB5/,"ФНКЦ ФМБА России выступит организатором международной конференции Кардио-2018 - Полезные связи - Страница истории России - HISTORYndex - Мы пишем историю",24,70,https://fnkc-fmba.ru/sobytiya/kardio-2018/,"С подробной программой мероприятия можно ознакомиться по",ссылке,". Конференция будет проходить по адресу г. Москва, Театральный проезд",Dofollow,,"2018-11-03 15:43:42","2020-04-23 12:19:05",,ru,0,0,,5
794,2,3,5,0,https://www.svyazy.ru/en/news/217.htm,"Media coverage of a cardiac surgeon conference in Yalta",12,5,https://fnkc-fmba.ru/about/,,"The Federal scientific and clinical center of the Federal Medical and Biological Agency of the Russian Federation","sustained by the Ministry of healthcare of RF and Republic","Dofollow, Content",,"2018-08-19 00:17:34","2020-05-25 01:40:42",,,0,0,,5
795,2,3,5,0,https://www.svyazy.ru/en/news/222.htm,"Poleznye svyazy starts with medicine",12,5,https://fnkc-fmba.ru/,"in March 2018th the Communications Agency Poleznye svyazy will promote","the Federal Research and Clinical Center","of Specialized Medical Assistance and Medical Technologies of the Federal","Dofollow, Content",,"2018-08-17 11:21:20","2020-05-25 02:22:48",,,0,0,,5
796,2,3,5,0,https://www.svyazy.ru/en/news/227.htm,"Obesity counteracting day in Kuzminki city park",11,5,https://fnkc-fmba.ru/,"held at the Kuzminki Park for Moscow residents supported by","the Federal Research and Clinical Center FMBA Russia",". The event focused on the healthy life style and","Dofollow, Content",,"2018-08-23 19:59:27","2020-05-25 03:27:34",,,0,0,,5
797,2,3,5,0,https://www.svyazy.ru/ru/news/227.htm,"День борьбы с ожирением в Кузьминках",12,5,https://fnkc-fmba.ru/,"10 июня для москвичей в парке «Кузьминки» при участии","Федерального научно-клинического центра ФМБА России","прошла акция «День борьбы с ожирением». Программа мероприятия, посвященного здоровому","Dofollow, Content",,"2018-08-29 06:56:35","2020-05-25 02:58:31",,,0,0,,5
798,1,3,5,0,https://www.svyazy.ru/ru/news/217.htm,"Информационная поддержка конференции кардиохирургов в Ялте",13,5,https://fnkc-fmba.ru/about/,"С 20 по 22 октября","Федеральный научно-клинический центр ФМБА России","при поддержке Министерств здравоохранения России и Республики Крым провел в","Dofollow, Content",,"2018-08-16 13:17:10","2020-05-25 01:08:06",,,0,0,,5
799,1,3,5,0,https://www.svyazy.ru/ru/news/222.htm,"«Полезные связи» займутся медициной",13,5,https://fnkc-fmba.ru/,"видов медицинской помощи и медицинских технологий Федерального медико-биологического агентства» (","ФГБУ ФНКЦ ФМБА России","). В рамках контракта планируется организовать системную работу экспертов Центра","Dofollow, Content",,"2018-08-19 20:43:07","2020-05-25 02:02:53",,,0,0,,5
800,1,3,5,0,http://historyndex.com/page-history/v-jalte-sostoitsja-nauchno-prakticheskaja-konferencija-kardiokrym-2018-7DE2/,"В Ялте состоится научно-практическая конференция КАРДИОКРЫМ-2018 - Полезные связи - Страница истории России - HISTORYndex - Мы пишем историю",24,67,https://fnkc-fmba.ru/sobytiya/kardiokrym-2018/,"Resort & SPA . Регистрация на мероприятие доступна по ссылке:",https://fnkc-fmba.ru/sobytiya/kardiokrym-2018/,,Dofollow,,"2018-11-25 13:38:54","2020-05-18 08:53:48",,ru,0,0,,5
801,1,3,5,0,"http://historyndex.com/page-history/7-fevralja-sostoitsja-konkurs-manualnyh-navykov,-organizovannyj-fnkc-fmba-rossii/","7 февраля состоится конкурс мануальных навыков, организованный ФНКЦ ФМБА России - Полезные связи - Страница истории России - HISTORYndex - Мы пишем историю",24,69,https://fnkc-fmba.ru/sobytiya/prekurs-khirurgiya-pakhovykh-gryzh/,"Более подробная информация на сайте",https://fnkc-fmba.ru/sobytiya/prekurs-khirurgiya-pakhovykh-gryzh/,,Dofollow,,"2019-02-09 04:22:52","2020-05-02 20:26:20",,ru,0,0,,5
802,1,3,5,0,"http://historyndex.com/page-history/8-fevralja-sostoitsja-nauchno-prakticheskaja-konferencija-«jendovideohirurgija-pahovyh-gryzh»,-organizovannyj-fnkc-fmba-rossii/","8 февраля состоится научно-практическая конференция «Эндовидеохирургия паховых грыж», организованный ФНКЦ ФМБА России - Полезные связи - Страница истории России - HISTORYndex - Мы пишем историю",24,67,https://fnkc-fmba.ru/sobytiya/endovideokhirurgiya-pakhovykh-gryzh/,"Более подробная информация на сайте",https://fnkc-fmba.ru/sobytiya/endovideokhirurgiya-pakhovykh-gryzh/,,Dofollow,,"2019-02-09 07:26:46","2020-05-16 20:45:05",,ru,0,0,,5
803,2,3,5,0,http://freezona.name/dir/medicina_i_zdorove/medicinskie_organizacii_i_uchrezhdenija/priem_mammologa_pulmonologija_v_moskve_klinicheskaja_bolnica_83/86-1-0-4783,"Прием маммолога, пульмонология в Москве. Клиническая больница 83 - Медицинские организации и учреждения - Медицина и здоровье - Каталог сайтов",44,27,http://fnkc-fmba.ru/,,http://www.kb83.com/,,"Dofollow, Content",,"2016-01-01 04:10:06","2020-06-03 15:07:33",,ru,0,0,,20
804,1,3,5,0,https://www.googlevisitor.com/third-russian-coronavirus-doctor-plummets-from-hospital-window-under-hazy-circumstances-reports-say/,"Third Russian coronavirus doctor plummets from hospital window under hazy circumstances, reports say",157,16,https://fnkc-fmba.ru/news/kollektiv-fnkts-fmba-rossii-vyrazhaet-soboleznovaniya/,"the coronavirus, according to a local report . A hospital",statement,"said she died “as a result of an accident.”","Dofollow, Content",,"2020-06-07 12:25:44","2020-06-07 12:25:44",,en,0,0,,8
805,2,3,5,0,https://www.вашкишечник.рф/адреса-клиник/,"Адреса клиник – ВашКишечник.рф",5,245,http://fnkc-fmba.ru/,,http://fnkc-fmba.ru,,Dofollow,,"2018-01-10 00:03:40","2020-06-15 22:21:23",,,0.03,10,,158
806,2,4,5,0,https://tumor.su/ssilki.html?task=all_category_links&cid=1&sby=3,"Онкология, деонтология, медицина - Каталог ссылок",19,1430,http://fnkc-fmba.ru/,,"Селективная ангиография. Подробнее на сайте",,Dofollow,,"2020-01-06 19:19:28","2020-04-18 14:33:03",,,0,0,,1163
807,3,3,5,0,http://historyndex.com/page-history/federalnyj-nauchno-klinicheskij-centr-fmba-rossii-podelitsja-opytom-v-lechenii-novoobrazovanij-molochnoj-zhelezy-AED0/,"Федеральный научно-клинический центр ФМБА России поделится опытом в лечении новообразований молочной железы - Полезные связи - Страница истории России - HISTORYndex - Мы пишем историю",24,72,http://fnkc-fmba.ru/sobytiya/,"Регистрация на семинар на сайте",https://fnkc-fmba.ru/aktsii/otkrytyy-seminar-dlya-zhenshchin-po-onkologicheskim-zabolevaniya-molochnoy-zhelezy/,,Dofollow,,"2019-11-07 03:21:02","2020-04-10 12:08:35",,ru,0,0,,5
808,2,2,5,0,https://vincentidele.com/2020/05/07/why-are-russian-coronavirus-doctors-mysteriously-falling-out-of-windows/,"Why are Russian coronavirus doctors mysteriously falling out of windows? | vincent idele's blog",61,31,https://fnkc-fmba.ru/news/kollektiv-fnkts-fmba-rossii-vyrazhaet-soboleznovaniya/,"hospital where she died releasing a statement saying she “","died tragically","” in an “ accident ,” with no additional details","Dofollow, Content",,"2020-05-10 06:11:32","2020-05-10 06:11:32",,en,0,0,,22
809,22,5,5,0,https://totadres.ru/moskva/org/federalnyy_nauchno-klinicheskiy_centr_specializirovannyh_vidov_medicinskoy_pomoschi_i_medicinskih_tehnologiy_fmba_rossii_konsultativno-diagnosticheskiy_centr/423697,"Федеральный научно-клинический центр специализированных видов медицинской помощи и медицинских технологий ФМБА России, Консультативно-диагностический центр, бульвар Ореховый, дом 28, Москва — адрес, часы работы, телефон",21,5,http://fnkc-fmba.ru/,,fnkc-fmba.ru,,Nofollow,,"2020-04-25 23:46:36","2020-05-01 14:14:59",,ru,0,0,,4
810,6,3,5,0,http://www.instructorakpp.ru/dir/medicina_i_zdorove/medicinskie_organizacii_i_uchrezhdenija/86-19-2,"Медицинские организации и учреждения - Медицина и здоровье - Каталог сайтов - Автоинструктор акпп автомат в Санкт-Петербурге обучение",106,71,http://fnkc-fmba.ru/,,"Клиническая больница, консультация кардиолога. Цены на нашем сайте",,Dofollow,,"2017-02-20 18:58:55","2020-04-26 12:13:03",,ru,0,0,,34
811,28,3,5,0,https://www.kret.msk-i.ru/catalog/hospitals_and_clinics/fnkts_fmba_rossii/,"ФНКЦ ФМБА России – Москва | Больницы и госпитали – Москва | Единая справочная",22,65,http://fnkc-fmba.ru/,,fnkc-fmba.ru,,Nofollow,,"2019-08-20 06:51:32","2020-05-13 13:53:03",,ru,0,0,,11
812,2,3,5,0,http://www.izazap.net/dir/medicina_i_zdorove/medicinskie_organizacii_i_uchrezhdenija/priem_ehndokrinologa_nevrologija_i_nejrokhirurgija_informacija_na_sajte/86-1-0-6215,"Прием эндокринолога, неврология и нейрохирургия, информация на сайте - Медицинские организации и учреждения - Медицина и здоровье - Белый каталог сайтов",46,41,http://fnkc-fmba.ru/,,http://www.kb83.com/,,Nofollow,,"2016-04-21 21:58:41","2020-06-03 12:05:41",,,0,0,,24
813,1,3,5,0,"http://bulletintalk.com/news/429666057/Third-Russian-coronavirus-doctor-plummets-from-hospital-window-under-hazy-circumstances,-reports-say---Fox-News","Third Russian coronavirus doctor plummets from hospital window under hazy circumstances, reports say - Fox News",70,8,https://fnkc-fmba.ru/news/kollektiv-fnkts-fmba-rossii-vyrazhaet-soboleznovaniya/,"the coronavirus, according to a local report . A hospital",statement,"said she died ""as a result of an accident.""","Dofollow, Content",,"2020-05-18 19:24:03","2020-06-13 19:47:34",,en,0,0,,4
814,1,6,5,0,http://46.29.163.254/wiki/Федеральное_медико-биологическое_агентство,"Федеральное медико-биологическое агентство Википедия",113,19,https://fnkc-fmba.ru/,,"Официальный сайт ФНКЦ ФМБА России",,Nofollow,,"2020-02-10 16:08:51","2020-06-09 05:29:14",,ru,0,0,,12
815,1,3,5,0,https://cardioquiron.com/the-moscow-international-ventricular-tachycardia-summit/,"The Moscow International Ventricular Tachycardia Summit - Cardio Quirón",67,10,https://fnkc-fmba.ru/sobytiya/the-moscow-international-ventricular-tachycardia-summit/,,"Puedes consultar el programa del evento, aquí",,Dofollow,,"2019-11-06 00:19:23","2020-05-22 20:24:26",,,0,0,,6
816,4,2,5,0,https://твоястрана.рф/центр/москва/компания/федеральный-научно-клиниче-3,"Федеральный научно-клинический центр специализированных видов медицинской помощи и медицинских технологий ФМБА России, индекс 115682 и отзывы в Москве",17,3,http://fnkc-fmba.ru/,,www.kb83.com,,Nofollow,,"2018-04-26 11:18:38","2019-12-28 12:13:20",,ru,0,0,,2
817,1,3,5,0,https://spinolog.com/gryzha/8-vidov-operacij-udalenie-gryzhi-pojasnichnogo-otdela.html,"Удаление грыжи позвоночника поясничного отдела: показания, опасна ли, как удаляют грыжу позвоночника",30,5,https://fnkc-fmba.ru/,"При поддержке","ФНКЦ ФМБА",.,"Nofollow, Content",,"2019-08-13 10:21:48","2020-05-25 23:29:17",,ru,0,0,,3
818,2,3,5,0,http://www.instructorakpp.ru/dir/medicina_i_zdorove/medicinskie_organizacii_i_uchrezhdenija/klinicheskaja_bolnica_konsultacija_kardiologa_ceny_na_nashem_sajte/86-1-0-2267,"Клиническая больница, консультация кардиолога. Цены на нашем сайте - Медицинские организации и учреждения - Медицина и здоровье - Каталог сайтов - Автоинструктор акпп автомат в Санкт-Петербурге обучение",41,6,http://fnkc-fmba.ru/,,http://www.kb83.com/,,"Dofollow, Content",,"2020-02-25 11:56:50","2020-06-10 06:59:58",,ru,0,0,,5
819,1,3,5,0,https://viralzergnet.com/why-are-russian-coronavirus-doctors-mysteriously-falling-out-of-windows/,"Why are Russian coronavirus doctors mysteriously falling out of windows?",49,30,https://fnkc-fmba.ru/news/kollektiv-fnkts-fmba-rossii-vyrazhaet-soboleznovaniya/,"hospital where she died releasing a statement saying she “","died tragically","” in an “ accident ,” with no additional details","Dofollow, Content",,"2020-05-29 01:53:51","2020-05-29 01:53:51",,en,0,0,,23
820,4,1,5,0,http://такси-03.рф/47-news/newsflash/298-spisok-bolnits,"Список больниц",10,764,http://fnkc-fmba.ru/,,www.kb83.com,,Dofollow,,"2019-07-13 16:15:05","2020-05-19 09:04:15",,ru,0,0,,92
821,1,0,5,0,https://newslinda.com/three-russian-doctors-have-fallen-out-of-windows-in-just-over-a-week/,"Latest News: Three Russian Doctors Have Fallen Out Of Windows In Just Over A Week",20,28,https://fnkc-fmba.ru/news/kollektiv-fnkts-fmba-rossii-vyrazhaet-soboleznovaniya/,"a result of an accident,"" according to a Moscow hospital.",declaration,". She had been hospitalized with COVID-19.","Nofollow, Content",,"2020-05-07 20:20:00","2020-05-14 13:29:09",,en,0,0,,23
822,4,2,5,0,http://www.avtoinfo.info/kat/6/2659.htm,"Модерируемый каталог автомобильных сайтов - Лучшие статусы на различную ...",23,9,http://fnkc-fmba.ru/,,http://www.kb83.com,,Nofollow,,"2020-04-25 08:20:36","2020-06-10 13:57:48",,ru,0,0,,4
823,1,3,5,0,https://enewsplanet.com/russian-coronavirus-doctors-are-mysteriously-falling-out-of-windows/,"Russian coronavirus doctors are mysteriously falling out of windows",32,28,https://fnkc-fmba.ru/news/kollektiv-fnkts-fmba-rossii-vyrazhaet-soboleznovaniya/,"where she passed away launching a declaration saying she “","passed away unfortunately","” in an “ mishap ,” without any extra information","Dofollow, Content",,"2020-05-13 22:05:37","2020-06-14 23:54:06",,en,0,0,,21
824,1,3,5,0,https://enewsplanet.com/third-russian-coronavirus-doctor-plummets-from-hospital-window-under-hazy-circumstances-reports-say/,"Third Russian coronavirus doctor plummets from hospital window under hazy circumstances, reports say",33,10,https://fnkc-fmba.ru/news/kollektiv-fnkts-fmba-rossii-vyrazhaet-soboleznovaniya/,"the coronavirus, according to a local report . A hospital",statement,"said she died “as a result of an accident.”","Dofollow, Content",,"2020-05-10 17:38:09","2020-06-07 03:05:17",,en,0,0,,7
825,2,3,5,0,http://www.toplist.co.in/domain-list-322,"Alexa top domain list || page 322",906,1508,http://fnkc-fmba.ru/,,fnkc-fmba.ru,,Nofollow,,"2020-05-26 03:49:54","2020-06-07 11:07:18",,,0,0,,811
826,2,2,4,0,http://promzone.autosng.ru/link/18157,"kb83 - Promzone.autosng.ru",10,4,http://fnkc-fmba.ru/bitrix/rk.php?goto=http://potolkisochi.ru,,kb83,,Dofollow,,"2020-04-02 15:29:17","2020-04-02 15:29:17",,ru,0,0,,3
827,1,0,4,0,https://plasticsurgery.ru/kontakty,"Контакты | Плахотин Владимир Николаевич - Пластический хирург",4,102,https://fnkc-fmba.ru/,Сайт:,fnkc-fmba.ru,,Dofollow,,"2020-05-10 11:16:14","2020-05-16 17:27:43",,ru,0,0,,11
828,1,2,4,0,https://www.corona-covid19.be/world/corona-russian-coronavirus-doctors-are-mysteriously-falling-out-of-windows/,"Corona Russian coronavirus doctors are mysteriously falling out of windows % - Coronavirus - COVID-19",35,30,https://fnkc-fmba.ru/news/kollektiv-fnkts-fmba-rossii-vyrazhaet-soboleznovaniya/,"hospital where she died releasing a statement saying she “","died tragically","” in an “ accident ,” with no additional details","Dofollow, Content",,"2020-05-12 14:29:05","2020-05-26 02:23:44",,,0,2,,22
829,1,2,4,0,https://www.corona-covid19.be/world/corona-third-russian-coronavirus-doctor-plummets-from-hospital-window-under-hazy-circumstances-reports-say/,"Corona Third Russian coronavirus doctor plummets from hospital window under hazy circumstances, reports say % - Coronavirus - COVID-19",36,12,https://fnkc-fmba.ru/news/kollektiv-fnkts-fmba-rossii-vyrazhaet-soboleznovaniya/,"the coronavirus, according to a local report . A hospital",statement,"said she died “as a result of an accident.”","Dofollow, Content",,"2020-05-07 15:21:26","2020-05-26 05:55:11",,,0,3,,8
830,2,2,4,0,http://www.love.net.in/domain-list-322,"Alexa top domain list || page 322",877,1507,http://fnkc-fmba.ru/,,fnkc-fmba.ru,,Nofollow,,"2020-05-25 00:33:27","2020-06-11 22:56:37",,en,0,0,,811
831,1,6,4,0,https://mynaijablog.com/news/world/3-russian-doctors-have-fallen-from-hospital-windows-amid-covid-19-pandemic-reports/,"3 Russian doctors have fallen from hospital windows amid COVID-19 pandemic: reports | MyNaijaBlog.Com",85,43,https://fnkc-fmba.ru/news/kollektiv-fnkts-fmba-rossii-vyrazhaet-soboleznovaniya/,"loss of life an “accident” in an announcement additionally shared","on the coaching centre’s web site.",,"Dofollow, Content",,"2020-05-08 10:35:35","2020-05-29 16:18:22",,en,0,0,,22
832,1,1,4,0,http://news.ofwgenie.info/russian-coronavirus-doctors-are-mysteriously-falling-out-of-windows/,"Russian coronavirus doctors are mysteriously falling out of windows - The Latest World News",44,43,https://fnkc-fmba.ru/news/kollektiv-fnkts-fmba-rossii-vyrazhaet-soboleznovaniya/,"hospital where she died releasing a statement saying she “","died tragically","” in an “ accident ,” with no additional details","Dofollow, Content",,"2020-05-09 16:24:33","2020-05-31 20:44:59",,en,0,0,,31
833,1,1,4,0,https://www.coronavirus.ma/three-russian-doctors-have-fallen-out-of-windows-in-just-over-a-week/,"Three Russian Doctors Have Fallen Out Of Windows In Just Over A Week - LATEST CORONAVIRUS NEWS",30,36,https://fnkc-fmba.ru/news/kollektiv-fnkts-fmba-rossii-vyrazhaet-soboleznovaniya/,"a result of an accident,” according to a Moscow hospital",statement,". She had been hospitalized with COVID-19.","Nofollow, Content",,"2020-05-10 12:27:48","2020-05-10 12:27:48",,en,0,0,,24
834,2,0,4,0,http://vashkishechnikru-prod.kwmu2bwtfe.eu-west-1.elasticbeanstalk.com/адреса-клиник/,"Адреса клиник – ВашКишечник.рф",5,225,http://fnkc-fmba.ru/,,http://fnkc-fmba.ru,,Dofollow,,"2017-03-14 02:49:33","2020-04-26 23:58:25",,,0.24,15,,151
835,1,1,4,0,https://hindiselearn.com/3-russian-doctors-have-fallen-from-hospital-windows-amid-covid-19-pandemic-reports-national/,"3 Russian doctors have fallen from hospital windows amid COVID-19 pandemic: reports - National | https://hindiselearn.com",34,38,https://fnkc-fmba.ru/news/kollektiv-fnkts-fmba-rossii-vyrazhaet-soboleznovaniya/,"called her death an “accident” in a statement also shared","on the training centre’s website.",,"Dofollow, Content",,"2020-05-08 00:56:56","2020-05-19 20:29:32",,en,0,0,,13
836,2,1,4,0,http://mig-rb.ru/uzi-sosudov-golovnogo-mozga/,"Узи сосудов головного мозга | ИБС.про",17,11,http://fnkc-fmba.ru/diagnostika/ultrazvukovaya-diagnostika-uzi/uzi-sosudov-golovnogo-mozga-i-shei/,Источник:,http://fnkc-fmba.ru/diagnostika/ultrazvukovaya-diagnostika-uzi/uzi-sosudov-golovnogo-mozga-i-shei/,,"Dofollow, Content",,"2019-01-15 14:56:53","2020-05-07 17:19:59",,,0,0,,9
837,4,1,4,0,http://www.onlinenewspaper.in/domain-list-322,"Alexa top domain list || page 322",847,1508,http://fnkc-fmba.ru/,,fnkc-fmba.ru,,Nofollow,,"2020-06-01 00:40:47","2020-06-11 23:47:34",,en,0,0,,813
838,2,1,4,0,https://cardiomanual.ru/torakoskopicheskaya-ablyaciya-po-povodu-fibrillyacii-predserdiy.html,"Торакоскопическая абляция по поводу фибрилляции предсердий",23,11,http://fnkc-fmba.ru/otdeleniya/khirurgicheskiy-profil/rasstantes-s-fibrillyatsiey-predserdiy/,,http://fnkc-fmba.ru/otdeleniya/khirurgicheskiy-profil/rasstantes-s-fibrillyatsiey-predserdiy/,,"Dofollow, Content",,"2019-03-24 04:46:16","2020-05-08 16:08:09",,ru,0,0,,5
839,2,1,4,0,https://cardiomanual.ru/bolnica-83-uzdg-ven-nizhnih-konechnostey.html,"Больница 83 уздг вен нижних конечностей",23,18,http://fnkc-fmba.ru/diagnostika/ultrazvukovaya-diagnostika-uzi/uzi-sosudov-nizhnikh-konechnostey/,,http://fnkc-fmba.ru/diagnostika/ultrazvukovaya-diagnostika-uzi/uzi-sosudov-nizhnikh-konechnostey/,,"Dofollow, Content",,"2020-01-12 03:16:25","2020-05-12 04:23:16",,ru,0,0,,11
840,2,1,4,0,https://cardiomanual.ru/maloinvazivnye-sposoby-koronarnogo-shuntirovaniya.html,"Малоинвазивные способы коронарного шунтирования",23,15,http://fnkc-fmba.ru/otdeleniya/khirurgicheskiy-profil/kardiokhirurgicheskoe-otdelenie/miniinvazivnoe-koronarnoe-shuntirovanie/,,http://fnkc-fmba.ru/otdeleniya/khirurgicheskiy-profil/kardiokhirurgicheskoe-otdelenie/miniinvazivnoe-koronarnoe-shuntirovanie/,,"Dofollow, Content",,"2019-05-05 22:21:21","2020-05-02 01:40:40",,ru,0,0,,10
841,3,1,4,0,http://tavton.ru/category/gosudarstvennyie-uchrezhdeniya/,"Государственные учреждения | tavton.ru — сертифицированный инсталятор информационных систем и систем безопасности",19,14,https://fnkc-fmba.ru/,,https://fnkc-fmba.ru/,,Dofollow,,"2018-02-04 10:56:07","2020-05-25 23:10:58",,,0,0,,10
842,1,0,4,0,https://kttx.com/2020/05/05/3-russian-doctors-have-fallen-from-hospital-windows-amid-covid-19-pandemic-reports-national/,"3 Russian doctors have fallen from hospital windows amid COVID-19 pandemic: reports - National - KT TX",65,50,https://fnkc-fmba.ru/news/kollektiv-fnkts-fmba-rossii-vyrazhaet-soboleznovaniya/,"called her death an “accident” in a statement also shared","on the training centre’s website.",,"Dofollow, Content",,"2020-06-07 07:56:15","2020-06-07 07:56:15",,en,0,0,,26
843,2,1,4,0,https://www.rawnews.com/third-russian-coronavirus-doctor-plummets-from-hospital-window-under-hazy-circumstances-reports-say/,"Third Russian coronavirus doctor plummets from hospital window under hazy circumstances, reports say - News",31,16,https://fnkc-fmba.ru/news/kollektiv-fnkts-fmba-rossii-vyrazhaet-soboleznovaniya/,"the coronavirus, according to a local report . A hospital",statement,"said she died “as a result of an accident.”","Dofollow, Content",,"2020-06-01 09:58:59","2020-06-01 09:58:59",,en,0,0,,8
844,6,1,4,0,http://www.instructorspb.ru/dir/medicina_i_zdorove/medicinskie_organizacii_i_uchrezhdenija/86-29,"Медицинские организации и учреждения - Медицина и здоровье - Каталог сайтов - Автоинструктор в Санкт-Петербурге (СПБ) обучит вождению",63,27,http://fnkc-fmba.ru/,,"Больница неврологии, ревматология в Москве. Все услуги на сайте",,Dofollow,,"2016-11-29 14:32:42","2020-05-20 02:22:05",,,0,0,,15
845,4,1,4,0,http://bossham.ru/catalog/uslugi/medicinskie-uslugi-i-ozdorovlenie?page=105,"Медицина - отзывы о компаниях - страница №105",39,11,http://fnkc-fmba.ru/,,kb83.com,,Nofollow,,"2018-05-03 13:26:03","2020-04-28 04:33:04",,ru,0,0,,10
846,2,1,4,0,http://bizcatalogy.ru/moskva/moskva/federalnyy-nauchno-klinicheskiy-centr/,"Федеральный научно-клинический центр в Москва Москва 115682 - Бизнес каталог",16,8,http://fnkc-fmba.ru/,,fnkc-fmba.ru,,Dofollow,,"2020-06-13 02:12:03","2020-06-13 02:12:03",,ru,0,0,,3
